{
  "viewing_id": "7c1f8a3e-2b4d-4f6a-9e8b-1d2c3b4a5f60",
  "raia_version": "0.2",
  "enquiry_id": "550e8400-e29b-41d4-a716-446655440000",
  "property_raia_id": "prop-gb-example-000001",
  "transaction_type": "LETTINGS",
  "jurisdiction": "GB",
  "buyer_agent": {
    "raia_id": "org-gb-buyeragent",
    "name": "Sample Buyer Agent",
    "agent_card_url": "https://buyeragent.example/.well-known/raia-agent.json"
  },
  "estate_agent": {
    "raia_id": "org-gb-example",
    "name": "Example Estates Ltd",
    "agent_card_url": "https://estates.example/.well-known/raia-agent.json"
  },
  "state": "PROPOSED",
  "enquiry_state": "DATA_GATHERING",
  "viewing_type": "IN_PERSON",
  "proposed_slots": [
    { "start": "2026-11-03T10:00:00Z", "end": "2026-11-03T10:30:00Z" },
    { "start": "2026-11-04T14:00:00Z", "end": "2026-11-04T14:30:00Z" },
    { "start": "2026-11-07T09:30:00Z", "end": "2026-11-07T10:00:00Z" }
  ],
  "confirmed_slot": null,
  "confirmed_at": null,
  "decline_reason": null,
  "notes": null,
  "created_at": "2026-10-27T11:00:00Z",
  "updated_at": null,
  "expires_at": "2026-11-02T11:00:00Z",
  "metadata": { "source": "sample" }
}
